{
  "id": "7b3e1f95-2a4c-4d88-91f6-3c5b8e0a7d42",
  "applies_to": {
    "equipment_class": ["switchboard"],
    "system": null,
    "location_type": null
  },
  "statement": "The equipment nameplate shows the panel tag in the project's tagging format.",
  "verification_method": "visual",
  "evidence_spec": [
    { "capture_recipe_id": "b41d8c60-7e29-4f53-a0c8-5d3f9b2e6a17", "version": "2.0.1" }
  ],
  "pass_criteria": {
    "kind": "pattern",
    "pattern": "^[A-Z]{2,4}-[0-9]{2,3}[A-Z]?$",
    "description": "The tag reads as two to four letters, a dash, then two or three numbers, e.g. SWBD-101.",
    "case_sensitive": true
  },
  "criticality": "quality",
  "source": {
    "doc_id": "1a8e4d70-5c92-4f31-8b6a-2e9d0c7f5a13",
    "clause": "26 05 53 - 2.1.A",
    "page": 3
  },
  "precedence_rank": 1,
  "why_it_matters": "A mislabelled panel sends the next person to the wrong board.",
  "status": "approved",
  "ruleset_version": "1.0.0"
}
